{
  "format": "llang-collection-runtime-stability-workload",
  "version": 1,
  "sourceWorkload": "benchmarks/collection-bottleneck-v1/workload.json",
  "sourceWorkloadHash": "6a1383d807c0a3c4d6663bbb701fb405a56b53a5b0fdb32363c704f9e032a11b",
  "orders": [
    {
      "blockId": 0,
      "orderId": "order-0",
      "direction": "forward",
      "caseIds": [
        "fold-small-a",
        "fold-medium-b",
        "fold-maximum-c",
        "map-small-a",
        "map-medium-b",
        "map-maximum-c",
        "filter-small-a",
        "filter-medium-b",
        "filter-maximum-c",
        "closure-small-a",
        "closure-medium-b",
        "closure-maximum-c",
        "sort-small-a",
        "sort-medium-b",
        "sort-maximum-c",
        "composite-small-a",
        "composite-medium-b",
        "composite-maximum-c",
        "string-small-a",
        "string-medium-b",
        "string-maximum-c",
        "generic-control",
        "union-control"
      ],
      "caseOrderHash": "dc630e8f62e94011b0bd88b0fbb464d8615b425e195fa0c83da6ce00aa168aac"
    },
    {
      "blockId": 1,
      "orderId": "order-1",
      "direction": "reverse",
      "caseIds": [
        "union-control",
        "generic-control",
        "string-maximum-c",
        "string-medium-b",
        "string-small-a",
        "composite-maximum-c",
        "composite-medium-b",
        "composite-small-a",
        "sort-maximum-c",
        "sort-medium-b",
        "sort-small-a",
        "closure-maximum-c",
        "closure-medium-b",
        "closure-small-a",
        "filter-maximum-c",
        "filter-medium-b",
        "filter-small-a",
        "map-maximum-c",
        "map-medium-b",
        "map-small-a",
        "fold-maximum-c",
        "fold-medium-b",
        "fold-small-a"
      ],
      "caseOrderHash": "2fdef5a56fa50eacbb7c6889788c754d83b668dbca3d05ce830ea669e9f2d92e"
    },
    {
      "blockId": 2,
      "orderId": "order-2",
      "direction": "forward",
      "caseIds": [
        "filter-maximum-c",
        "closure-small-a",
        "closure-medium-b",
        "closure-maximum-c",
        "sort-small-a",
        "sort-medium-b",
        "sort-maximum-c",
        "composite-small-a",
        "composite-medium-b",
        "composite-maximum-c",
        "string-small-a",
        "string-medium-b",
        "string-maximum-c",
        "generic-control",
        "union-control",
        "fold-small-a",
        "fold-medium-b",
        "fold-maximum-c",
        "map-small-a",
        "map-medium-b",
        "map-maximum-c",
        "filter-small-a",
        "filter-medium-b"
      ],
      "caseOrderHash": "133f49c4b34f47d920a352ad1ed4d81fdc0eaaf1cf38f2431b5e59196bf9284c"
    },
    {
      "blockId": 3,
      "orderId": "order-3",
      "direction": "reverse",
      "caseIds": [
        "filter-medium-b",
        "filter-small-a",
        "map-maximum-c",
        "map-medium-b",
        "map-small-a",
        "fold-maximum-c",
        "fold-medium-b",
        "fold-small-a",
        "union-control",
        "generic-control",
        "string-maximum-c",
        "string-medium-b",
        "string-small-a",
        "composite-maximum-c",
        "composite-medium-b",
        "composite-small-a",
        "sort-maximum-c",
        "sort-medium-b",
        "sort-small-a",
        "closure-maximum-c",
        "closure-medium-b",
        "closure-small-a",
        "filter-maximum-c"
      ],
      "caseOrderHash": "43b3fe1fc3cc3e31e23fb64446ded6694acc5fa378b97f9bba88515166864b4f"
    },
    {
      "blockId": 4,
      "orderId": "order-4",
      "direction": "forward",
      "caseIds": [
        "composite-medium-b",
        "composite-maximum-c",
        "string-small-a",
        "string-medium-b",
        "string-maximum-c",
        "generic-control",
        "union-control",
        "fold-small-a",
        "fold-medium-b",
        "fold-maximum-c",
        "map-small-a",
        "map-medium-b",
        "map-maximum-c",
        "filter-small-a",
        "filter-medium-b",
        "filter-maximum-c",
        "closure-small-a",
        "closure-medium-b",
        "closure-maximum-c",
        "sort-small-a",
        "sort-medium-b",
        "sort-maximum-c",
        "composite-small-a"
      ],
      "caseOrderHash": "1af75bfd916a0d31af654f53519b6b75057f0dc57aa55a5e9c84aa0c0fe6cf80"
    },
    {
      "blockId": 5,
      "orderId": "order-5",
      "direction": "reverse",
      "caseIds": [
        "composite-small-a",
        "sort-maximum-c",
        "sort-medium-b",
        "sort-small-a",
        "closure-maximum-c",
        "closure-medium-b",
        "closure-small-a",
        "filter-maximum-c",
        "filter-medium-b",
        "filter-small-a",
        "map-maximum-c",
        "map-medium-b",
        "map-small-a",
        "fold-maximum-c",
        "fold-medium-b",
        "fold-small-a",
        "union-control",
        "generic-control",
        "string-maximum-c",
        "string-medium-b",
        "string-small-a",
        "composite-maximum-c",
        "composite-medium-b"
      ],
      "caseOrderHash": "1eb73eb9a7cb911c0c502174df83f77e9c714de741329f3070944f06fdaf6c17"
    }
  ]
}
